{
	"$schema":"https://raw.githubusercontent.com/Boavizta/ai-power-measures-sharing/main/model/report_schema.json",
	"header": {
		"licensing": "Creative Commons 4.0",
		"formatVersion": "0.1",
		"reportId": "2f4643f7-68b5-4fb6-21f0-b5dcda04897d",
		"reportDatetime": "2024-07-01 08:30:00",
		"reportStatus": "draft",
		"publisher": {
			"confidentialityLevel": "public",
			"publicKey": "AAAAB3NzaC1yc2EAAAADAQABBBAAgQCSFe5dQLBl+USwot9wrko1tYvipUnXKMDGQuxtghQKbYRVOFMMsIntTqYw6wqRqenHqC3aWUpPdv1JUls9Rf32T5Xqdu+yEshvyGwyo+gHfRynZSF4Qe3wSf8kXYJVLbM0jRDPCKManruppKXr+aqIW8JiD+wfDsvBGhM5ftUKzw=="
		}
	},
	"task": {
		"taskType": "supervisedLearning",
		"taskFamily": "classification",
		"taskStage": "training",
		"algorithms": [
			{
				"algorithmName": "randomForest"
			}
		],
		"dataset": [
			{
				"dataType": "tabular",
				"fileType": "csv",
				"volume": 80,
				"volumeUnit": "megabyte",
				"items": 150000,
				"shape": [
					20,
					150000
				],
				"source": "private"
			}
		],
		"measuredAccuracy": 0.71
	},
	"measures": [
		{
			"measurementMethod": "codecarbon",
			"version": "2.5.0",
			"unit": "Wh",
			"powerConsumption": 351,
			"measurementDuration": 1500,
			"measurementDateTime": "2023-07-01 10:02:05"
		}
	],
	"system": {
		"os": "linux",
		"distribution": "ubuntu",
		"distributionVersion":"20.04"
	},
	"software": {
		"language": "python",
		"version": "3.9.0"
	},
	"infrastructure":{
		"infraType": "publicCloud",
		"cloudProvider": "aws",
		"cloudInstance": "a1.large",
		"components": [
			{
			   "componentName": "cpu",
			   "nbComponent": 4,
			   "memorySize": 32,
			   "manufacturer": "AMD",
			   "family": "Ryzen",
			   "series": "7000X3D"
			},
			{
				"componentName": "gpu",
				"nbComponent": 2,
				"memorySize": 64,
				"manufacturer": "NVIDIA",
			    "family": "GeForce",
			    "series": "rtx4080"
				}
		]
	},
	"environment": {
		"country": "france",
		"powerSupplierType": "public",
		"powerSource": "nuclear",
		"powerSourceCarbonIntensity": 25
	}
}
